{
  "$schema": "http://json-schema.org/draft-07/schema#",
  "$id": "https://fansafe.example/schemas/phrase.schema.json",
  "title": "FanSafe Phrase",
  "description": "Schema for a single entry in the contributor-side phrase source. tools/sync-phrases.js validates this shape before generating FanSafe_PWA/index.html's inline const phraseBook array; there is no runtime data fetch.",
  "type": "object",
  "additionalProperties": false,
  "required": ["id", "category", "values", "reviewStatus"],
  "properties": {
    "id": {
      "type": "string",
      "description": "Stable identifier, for example med1.",
      "pattern": "^[a-z][a-z0-9_]*$"
    },
    "category": {
      "type": "string",
      "description": "Must match a category id in FanSafe_PWA/index.html's const categories array.",
      "enum": [
        "emergency", "medical", "navigation", "transport",
        "hotel", "police", "lost_document", "ticket_scam"
      ]
    },
    "values": {
      "type": "object",
      "description": "Per-language phrase text. docs/content-governance.md requires every phrase to exist in all four languages before merge because the UI has no per-language fallback.",
      "additionalProperties": false,
      "required": ["id", "en", "es", "fr"],
      "properties": {
        "id": { "type": "string", "minLength": 1, "description": "Indonesian" },
        "en": { "type": "string", "minLength": 1, "description": "English" },
        "es": { "type": "string", "minLength": 1, "description": "Spanish" },
        "fr": { "type": "string", "minLength": 1, "description": "French" }
      }
    },
    "reviewStatus": {
      "type": "string",
      "description": "Do not claim native-speaker-reviewed or professionally-translated without an entry in reviewedBy. All phrases carried from the original inline phraseBook default to unreviewed because no translator or authorship record exists.",
      "enum": ["unreviewed", "maintainer-authored", "native-speaker-reviewed", "professionally-translated"]
    },
    "reviewedBy": {
      "type": "array",
      "description": "A fluent or native-speaker reviewer per language, especially for emergency and medical phrases. Required by tools/validate-phrases.js when reviewStatus is native-speaker-reviewed or professionally-translated.",
      "items": {
        "type": "object",
        "required": ["language", "reviewer"],
        "properties": {
          "language": { "type": "string", "enum": ["id", "en", "es", "fr"] },
          "reviewer": { "type": "string", "minLength": 1 }
        }
      }
    }
  }
}
